<?xml version="1.0" encoding="UTF-8"?>
<?xml-stylesheet type="text/xsl" href="press-releases.xsl"?>
<!-- Пресс-релизы Avocado Travel. Файл собирается из press-releases.json командой pnpm press:xml. -->
<pressReleases xmlns:xsi="http://www.w3.org/2001/XMLSchema-instance" xsi:noNamespaceSchemaLocation="press-releases.xsd">
  <release id="pr-001">
    <title>Avocado Travel объявляет о запуске сервиса продажи авиабилетов</title>
    <date>2026-02-10</date>
    <category>company</category>
    <author>Анна Белова</author>
    <summary>Новый сервис поможет купить билет на рейс по России и в соседние страны за пару минут — без лишних шагов и навязанных услуг.</summary>
    <body>Avocado Travel — сервис продажи авиабилетов, который делает покупку простой: нашли рейс, выбрали место, оплатили. Никаких страховок и такси, добавленных в заказ без спроса.

На старте в сеть входят 19 городов: от Калининграда до Владивостока, а также Стамбул, Дубай, Ереван, Ташкент и Пекин. Открытие сайта для всех пользователей запланировано на лето.

«Мы хотели сделать сервис, которым удобно пользоваться и с телефона, и с компьютера, — говорит руководитель проекта. — Каждую страницу мы проверяем на экране шириной 360 пикселей».</body>
  </release>
  <release id="pr-002">
    <title>Шесть авиакомпаний подписали соглашение с Avocado Travel</title>
    <date>2026-03-04</date>
    <category>partners</category>
    <author>Дмитрий Орлов</author>
    <summary>Ластавиа, Орнавиа, Аэрелла, Стрива, Кирра и Альтэйра будут продавать билеты через Avocado Travel с первого дня работы сервиса.</summary>
    <body>Соглашения охватывают все рейсы партнёров внутри сети Avocado Travel. Расписание и цены авиакомпаний попадают на сайт напрямую, поэтому пассажир видит актуальное число свободных мест.

У каждого партнёра своя специализация: Ластавиа связывает Москву с городами-миллионниками, Орнавиа летает на юг, Аэрелла — между городами Урала и Поволжья, Стрива выполняет короткие рейсы, Кирра включает багаж в тариф, а Альтэйра отвечает за дальние перелёты.

Сравнить авиакомпании можно в отдельной таблице: маршруты, флот и условия перевозки багажа.</body>
  </release>
  <release id="pr-003">
    <title>Поиск рейсов одной фразой: как устроен интерфейс Avocado Travel</title>
    <date>2026-03-26</date>
    <category>service</category>
    <author>Ольга Ким</author>
    <summary>Вместо формы из десятка полей — одно предложение: «Я лечу из Москвы в Казань 14 ноября, нас двое, класс эконом».</summary>
    <body>Команда Avocado Travel отказалась от привычной формы поиска. Пассажир заполняет пропуски в предложении, и запрос читается так же, как его произносят вслух.

Все параметры поиска сохраняются в адресе страницы, поэтому результатами можно поделиться ссылкой. Рейсы сортируются по цене, времени вылета и длительности, а фильтры помогают оставить только утренние рейсы или только тарифы с багажом.

Поиск работает и без JavaScript: форма отправляется обычным способом, а страница результатов собирается на сервере.</body>
  </release>
  <release id="pr-004">
    <title>Avocado Travel вошла в программу поддержки студенческих проектов</title>
    <date>2026-04-15</date>
    <category>company</category>
    <author>Сергей Литвинов</author>
    <summary>Проект получил консультации преподавателей и доступ к учебной инфраструктуре для разработки и тестирования.</summary>
    <body>Avocado Travel создаётся как учебный проект, и мы этого не скрываем: авиакомпании в сети выдуманные, а оплата демонстрационная. Зато технологии — настоящие, те же, что используют действующие сервисы.

Участие в программе позволило команде регулярно проверять решения с наставниками: от структуры базы данных до доступности интерфейса.

Все этапы разработки записываются в документацию проекта — её можно использовать как пример для следующих потоков студентов.</body>
  </release>
  <release id="pr-005">
    <title>Ереван и Ташкент станут первыми зарубежными направлениями</title>
    <date>2026-05-12</date>
    <category>routes</category>
    <author>Дмитрий Орлов</author>
    <summary>Рейсы в столицы Армении и Узбекистана откроются вместе с запуском сайта: из Москвы — ежедневно.</summary>
    <body>Ереван и Ташкент — одни из самых востребованных направлений у путешественников из России. Рейсы в оба города будут выполнять партнёры Avocado Travel из Москвы, а в Ереван — ещё и из Сочи.

На странице каждого направления есть описание города, погода на ближайшие дни и местное время. Курсы армянского драма и узбекского сума можно посмотреть в конвертере валют.

Вслед за Ереваном и Ташкентом в сеть войдут Стамбул, Дубай и Пекин.</body>
  </release>
  <release id="pr-006">
    <title>Место в самолёте можно выбрать до оплаты</title>
    <date>2026-06-02</date>
    <category>service</category>
    <author>Ольга Ким</author>
    <summary>На странице рейса — схема салона: пассажир сам выбирает кресла для всех, кто летит с ним, ещё до оформления заказа.</summary>
    <body>Схема салона строится по модели самолёта: число рядов, кресел в ряду и ряды бизнес-класса. Занятые места видны сразу, поэтому семья или компания друзей могут сесть рядом.

Выбранные места закрепляются за заказом, как только пассажир вводит имена и переходит к оплате. Одно место не может достаться двоим — это проверяет сама база данных.

Схема удобна и на телефоне: итоговая сумма и кнопка бронирования закреплены внизу экрана.</body>
  </release>
  <release id="pr-007">
    <title>Кирра включает 23 кг багажа во все тарифы эконом-класса</title>
    <date>2026-06-23</date>
    <category>partners</category>
    <author>Анна Белова</author>
    <summary>Пассажирам Кирры не придётся доплачивать за чемодан: багаж до 23 кг входит в цену каждого билета.</summary>
    <body>Кирра стала первой авиакомпанией сети, у которой багаж включён в тариф на всех рейсах. В результатах поиска такие рейсы легко найти с помощью фильтра «только с багажом».

По данным авиакомпании, больше половины пассажиров на её маршрутах летят с чемоданом, поэтому отдельная доплата лишь запутывала их.

Условия перевозки багажа у всех партнёров собраны в таблице авиакомпаний на сайте Avocado Travel.</body>
  </release>
  <release id="pr-008">
    <title>Альтэйра соединит Москву с Владивостоком и Иркутском</title>
    <date>2026-07-08</date>
    <category>routes</category>
    <author>Дмитрий Орлов</author>
    <summary>Дальние рейсы на широкофюзеляжных самолётах: во Владивосток — за девять часов, в Иркутск — без пересадок.</summary>
    <body>Альтэйра специализируется на дальних перелётах, и её рейсы на Дальний Восток и в Сибирь станут основой восточного направления сети Avocado Travel.

Во Владивосток авиакомпания летает на Boeing 777: в салоне есть ряды бизнес-класса и места с дополнительным пространством для ног в экономе.

Разницу во времени между Москвой и городом прилёта покажут мировые часы на странице «Сервисы» — это пригодится, чтобы не перепутать время вылета обратного рейса.</body>
  </release>
  <release id="pr-009">
    <title>Сайт Avocado Travel открыт для всех пользователей</title>
    <date>2026-07-25</date>
    <category>company</category>
    <author>Анна Белова</author>
    <summary>После полугода разработки и тестирования сервис доступен каждому: искать рейсы можно без регистрации.</summary>
    <body>С сегодняшнего дня купить билет на Avocado Travel может любой пользователь. Регистрация нужна только для бронирования — чтобы заказы сохранялись в личном кабинете.

Кроме продажи билетов, на сайте работают новости, форум путешественников, гостевая книга, конвертер валют и карта маршрутов.

«Нам важно мнение первых пользователей, — говорит руководитель проекта. — Оставить отзыв можно в гостевой книге, а оценить сайт — прямо на главной странице».</body>
  </release>
  <release id="pr-010">
    <title>Первый месяц работы: какие города ищут чаще всего</title>
    <date>2026-08-25</date>
    <category>results</category>
    <author>Сергей Литвинов</author>
    <summary>Лидеры поисковых запросов в августе — Сочи, Калининград и Санкт-Петербург; среди зарубежных направлений — Стамбул.</summary>
    <body>За первый месяц работы пользователи Avocado Travel чаще всего искали рейсы на море и в города с богатой историей. Сочи уверенно занял первое место, за ним идут Калининград и Санкт-Петербург.

Среди зарубежных направлений лидирует Стамбул, на втором месте — Ереван. Интерес к Пекину пока небольшой, но растёт с каждой неделей.

Чаще всего пользователи ищут билеты за две–три недели до вылета, а самый популярный день вылета — пятница.</body>
  </release>
  <release id="pr-011">
    <title>Места с дополнительным пространством для ног — за 900 рублей</title>
    <date>2026-08-28</date>
    <category>service</category>
    <author>Ольга Ким</author>
    <summary>Первый ряд эконома и ряд у аварийного выхода теперь отмечены на схеме салона, доплата одинакова на всех рейсах.</summary>
    <body>Пассажиры высокого роста давно просили возможность заранее выбрать кресло, где не придётся сидеть с коленями у подбородка. Теперь такие места выделены на схеме салона отдельной рамкой.

Доплата за место с дополнительным пространством — 900 ₽ к цене эконома. Она сразу видна в сумме заказа и не меняется после оформления.

Купить такое место можно и в заказе на нескольких пассажиров: доплата считается отдельно за каждое кресло.</body>
  </release>
  <release id="pr-012">
    <title>В Сочи — напрямую из Казани, Самары и Уфы</title>
    <date>2026-09-09</date>
    <category>routes</category>
    <author>Дмитрий Орлов</author>
    <summary>Жителям Поволжья больше не нужно лететь к морю через Москву: Орнавиа открыла прямые рейсы на юг.</summary>
    <body>Новые рейсы сокращают дорогу до Сочи в среднем на четыре часа: пересадка в Москве больше не нужна. Рейсы из Казани выполняются ежедневно, из Самары и Уфы — несколько раз в неделю.

Все маршруты сети видны на карте на странице «Сервисы»: щелчок по городу показывает, куда из него можно улететь.